{
  "$schema": "../../schemas/ion-nrpn.schema.json",
  "format": "aim-editor.ion-nrpn-spec",
  "schema_version": 1,
  "device": {
    "manufacturer": "Alesis",
    "models": [
      "Ion",
      "Micron",
      "Akai Miniak"
    ]
  },
  "research_state": {
    "status": "candidate",
    "hardware_verified": false,
    "source": {
      "kind": "community_reverse_engineering",
      "title": "Common FAQ \u2013 MIDI implementation / NRPNs",
      "url": "https://ion-micron-miniak.fandom.com/wiki/Common_FAQ",
      "note": "The source explicitly calls this table preliminary and says it contains mistakes. AIM Editor therefore keeps every imported mapping candidate until verified independently or against hardware."
    },
    "independent_corroboration": {
      "source": "research/external/micronau-evidence.json",
      "scope": "selected transport/parameter facts only",
      "hardware_verified": false
    }
  },
  "transport": {
    "address": {
      "cc_msb": 99,
      "cc_lsb": 98,
      "formula": "nrpn = (cc99_value << 7) | cc98_value"
    },
    "value": {
      "cc_msb": 6,
      "cc_lsb": 38,
      "formula": "value14 = (cc6_value << 7) | cc38_value"
    },
    "alesis_quirks": [
      "For values that fit in 7 bits, community evidence says Alesis expects the Data Entry LSB (CC38), not only the MSB (CC6) used by many generic NRPN controllers.",
      "Signed parameter values wrap in the 14-bit space: encoded = value for non-negative values, or 16384 + value for negative values.",
      "Some addresses above the root range may be controller-assignment aliases; prefer root addresses where known.",
      "Do not enable automatic live writes solely from this candidate table without hardware/capture verification."
    ],
    "signed_14": {
      "minimum": -8192,
      "maximum": 8191,
      "modulus": 16384,
      "encode_negative": "16384 + signed_value"
    }
  },
  "known_conflicts": [
    {
      "id": "output.fx_mix",
      "nrpn_domain": [
        -50,
        50
      ],
      "sysex_candidate_domain": [
        0,
        100
      ],
      "status": "unresolved"
    },
    {
      "id": "lfo1.reset_mode",
      "nrpn_domain": [
        0,
        6
      ],
      "sysex_candidate_domain": [
        0,
        4
      ],
      "status": "unresolved"
    },
    {
      "id": "lfo2.reset_mode",
      "nrpn_domain": [
        0,
        6
      ],
      "sysex_candidate_domain": [
        0,
        4
      ],
      "status": "unresolved"
    },
    {
      "id": "sample_hold.input",
      "nrpn_domain": [
        0,
        1
      ],
      "reason": "Community NRPN table range is inconsistent with the known large modulation-source set.",
      "status": "likely_source_error"
    },
    {
      "id": "tracking_generator.input",
      "nrpn_domain": [
        0,
        111
      ],
      "reason": "Candidate SysEx source uses a different raw domain; translation is not yet established.",
      "status": "unresolved"
    },
    {
      "id": "program.category",
      "nrpn_domain": [
        0,
        8
      ],
      "reason": "Candidate SysEx source reports a larger category domain.",
      "status": "unresolved"
    },
    {
      "id": "mod_matrix.slot01.source",
      "nrpn_domain": [
        0,
        77
      ],
      "reason": "Slots 2..12 use 0..114 in the same source table.",
      "status": "likely_source_error"
    },
    {
      "id": "micronau-nrpn-105",
      "number": 105,
      "aim_candidate": "lfo1.sync",
      "micronau_candidate": "micron file id",
      "status": "hold_per_device_hardware_verification_required",
      "source": "research/external/micronau-evidence.json"
    },
    {
      "id": "micronau-nrpn-250",
      "number": 250,
      "aim_candidate": "effects.param_a_synced",
      "micronau_candidate": "fifth selected FX2 parameter",
      "status": "hold_algorithm_and_device_verification_required",
      "source": "research/external/micronau-evidence.json"
    }
  ],
  "parameters": [
    {
      "number": 0,
      "id": "voice.poly_mode",
      "name": "Polyphony / mono-poly mode",
      "min": 0,
      "max": 1,
      "value_encoding": "unsigned_14",
      "status": "candidate",
      "hardware_verified": false
    },
    {
      "number": 1,
      "id": "voice.unison_voices",
      "name": "Unison voices",
      "min": 0,
      "max": 3,
      "value_encoding": "unsigned_14",
      "status": "candidate",
      "hardware_verified": false
    },
    {
      "number": 2,
      "id": "voice.unison_detune",
      "name": "Unison detune",
      "min": 0,
      "max": 100,
      "value_encoding": "unsigned_14",
      "status": "candidate",
      "hardware_verified": false
    },
    {
      "number": 3,
      "id": "voice.portamento_enable",
      "name": "Portamento enabled",
      "min": 0,
      "max": 2,
      "value_encoding": "unsigned_14",
      "status": "candidate",
      "hardware_verified": false
    },
    {
      "number": 4,
      "id": "voice.portamento_type",
      "name": "Portamento type",
      "min": 0,
      "max": 3,
      "value_encoding": "unsigned_14",
      "status": "candidate",
      "hardware_verified": false
    },
    {
      "number": 5,
      "id": "voice.portamento_time",
      "name": "Portamento time",
      "min": 0,
      "max": 127,
      "value_encoding": "unsigned_14",
      "status": "candidate",
      "hardware_verified": false
    },
    {
      "number": 6,
      "id": "voice.pitch_wheel_mode",
      "name": "Pitchwheel type",
      "min": 0,
      "max": 1,
      "value_encoding": "unsigned_14",
      "status": "candidate",
      "hardware_verified": false
    },
    {
      "number": 7,
      "id": "voice.analog_drift",
      "name": "Analog drift",
      "min": 0,
      "max": 100,
      "value_encoding": "unsigned_14",
      "status": "candidate",
      "hardware_verified": false
    },
    {
      "number": 8,
      "id": "osc.sync_type",
      "name": "Oscillator sync type",
      "min": 0,
      "max": 4,
      "value_encoding": "unsigned_14",
      "status": "candidate",
      "hardware_verified": false
    },
    {
      "number": 9,
      "id": "osc.fm_amount",
      "name": "FM amount",
      "min": 0,
      "max": 1000,
      "value_encoding": "unsigned_14",
      "status": "candidate",
      "hardware_verified": false
    },
    {
      "number": 10,
      "id": "osc.fm_type",
      "name": "FM type",
      "min": 0,
      "max": 5,
      "value_encoding": "unsigned_14",
      "status": "candidate",
      "hardware_verified": false
    },
    {
      "number": 11,
      "id": "osc1.waveform",
      "name": "Oscillator 1 waveform",
      "min": 0,
      "max": 2,
      "value_encoding": "unsigned_14",
      "status": "candidate",
      "hardware_verified": false
    },
    {
      "number": 12,
      "id": "osc1.shape",
      "name": "Oscillator 1 wave shape",
      "min": -100,
      "max": 100,
      "value_encoding": "signed_14_wrap",
      "status": "candidate",
      "hardware_verified": false
    },
    {
      "number": 13,
      "id": "osc1.octave",
      "name": "Oscillator 1 octave",
      "min": -3,
      "max": 3,
      "value_encoding": "signed_14_wrap",
      "status": "candidate",
      "hardware_verified": false
    },
    {
      "number": 14,
      "id": "osc1.semitone",
      "name": "Oscillator 1 transpose",
      "min": -7,
      "max": 7,
      "value_encoding": "signed_14_wrap",
      "status": "candidate",
      "hardware_verified": false
    },
    {
      "number": 15,
      "id": "osc1.fine",
      "name": "Oscillator 1 pitch",
      "min": -999,
      "max": 999,
      "value_encoding": "signed_14_wrap",
      "status": "candidate",
      "hardware_verified": false
    },
    {
      "number": 16,
      "id": "osc1.wheel",
      "name": "Oscillator 1 pitchwheel range",
      "min": 0,
      "max": 12,
      "value_encoding": "unsigned_14",
      "status": "candidate",
      "hardware_verified": false
    },
    {
      "number": 17,
      "id": "osc2.waveform",
      "name": "Oscillator 2 waveform",
      "min": 0,
      "max": 2,
      "value_encoding": "unsigned_14",
      "status": "candidate",
      "hardware_verified": false
    },
    {
      "number": 18,
      "id": "osc2.shape",
      "name": "Oscillator 2 wave shape",
      "min": -100,
      "max": 100,
      "value_encoding": "signed_14_wrap",
      "status": "candidate",
      "hardware_verified": false
    },
    {
      "number": 19,
      "id": "osc2.octave",
      "name": "Oscillator 2 octave",
      "min": -3,
      "max": 3,
      "value_encoding": "signed_14_wrap",
      "status": "candidate",
      "hardware_verified": false
    },
    {
      "number": 20,
      "id": "osc2.semitone",
      "name": "Oscillator 2 transpose",
      "min": -7,
      "max": 7,
      "value_encoding": "signed_14_wrap",
      "status": "candidate",
      "hardware_verified": false
    },
    {
      "number": 21,
      "id": "osc2.fine",
      "name": "Oscillator 2 pitch",
      "min": -999,
      "max": 999,
      "value_encoding": "signed_14_wrap",
      "status": "candidate",
      "hardware_verified": false
    },
    {
      "number": 22,
      "id": "osc2.wheel",
      "name": "Oscillator 2 pitchwheel range",
      "min": 0,
      "max": 12,
      "value_encoding": "unsigned_14",
      "status": "candidate",
      "hardware_verified": false
    },
    {
      "number": 23,
      "id": "osc3.waveform",
      "name": "Oscillator 3 waveform",
      "min": 0,
      "max": 2,
      "value_encoding": "unsigned_14",
      "status": "candidate",
      "hardware_verified": false
    },
    {
      "number": 24,
      "id": "osc3.shape",
      "name": "Oscillator 3 wave shape",
      "min": -100,
      "max": 100,
      "value_encoding": "signed_14_wrap",
      "status": "candidate",
      "hardware_verified": false
    },
    {
      "number": 25,
      "id": "osc3.octave",
      "name": "Oscillator 3 octave",
      "min": -3,
      "max": 3,